id,general_plant_id,threatened_plant_id,common_name,scientific_name,other_name,species_epithet,genus,origin,type,cycle,propagation,watering,watering_benchmark,watering_unit,sunlight,pruning_month,growth_rate,care_level,medicinal,description,image_url,hardiness_min,hardiness_max,hardiness_map_url
92,92,92,Oshio Beni Japanese Maple,Acer palmatum 'Oshio Beni',,palmatum,Acer,Japan,tree,Perennial,"Grafting Propagation, Cutting, Layering Propagation, Air Layering Propagation, Root Division",Average,,days,"full sun, part shade","February, March, April",Low,Medium,False,"The Oshio Beni Japanese Maple is a stunning variety of maple tree with a unique color combination. It is a tall, upright tree with conspicuous, delicate red-purple leaves, highlighting white veins and a light yellow to green center. In fall, lit up by the setting sun, the foliage creates a stunning blend of deep red, scarlet and orange. Its elegant form makes it a great choice for entryways and focal points. It is also very low maintenance, and tolerant of a variety of conditions. With its striking colors, Oshio Beni Japanese Maple is a must-have for any garden!",https://perenual.com/storage/species_image/92_acer_palmatum_oshio_beni/og/2560px-Acer_palmatum_27Oshio_beni27_-_JPG3.jpg,6,6,https://perenual.com/api/hardiness-map?species_id=92&size=og&key=sk-3ksU68b046f66e1f912089
93,93,93,Oshu Shidare Japanese Maple,Acer palmatum 'Oshu Shidare',,palmatum,Acer,Japan,tree,Perennial,"Air Layering Propagation, Grafting Propagation, Cutting, Division, Seed Propagation",Frequent,"""3-4""",days,"full sun, part shade","February, March, April",Low,Medium,False,"The Oshu Shidare Japanese Maple (Acer palmatum 'Oshu Shidare') is an incredible plant to add to any garden. With its attractive, cascading branches, the maple has the ability to attract attention and provide a visual focal point. The foliage is a deep reddish-purple, which transforms to fiery oranges and reds in the fall. This versatile tree can be grown as a shrub or as a single-trunked tree. It also has a wide range of sizes, allowing it to look great in any setting. Plus, this long-living maple is pest-, disease-, and drought-resistant, making it an excellent choice.",https://perenual.com/storage/species_image/93_acer_palmatum_oshu_shidare/og/Acer_palmatum_Oshu_shidare_0zz.jpg,6,6,https://perenual.com/api/hardiness-map?species_id=93&size=og&key=sk-3ksU68b046f66e1f912089
94,94,94,Otake Japanese Maple,Acer palmatum 'Otake',,palmatum,Acer,Japan,tree,Perennial,"Grafting Propagation, Layering Propagation, Cutting, Air Layering Propagation, Root Division",Frequent,"""7-10""",days,"full sun, part shade","March, April",Low,Medium,False,"Otake Japanese Maple (Acer palmatum 'Otake') is an amazing ornamental tree that is sure to leave a lasting impression in any garden. Its beautiful yellow and green foliage pairs perfectly with its low mounding habit, making it a great addition to any landscape. This tree is also extremely drought-tolerant, making it ideal for areas with unpredictable weather. Additionally, its strong branches provide it with excellent wind resistance and its growth rate means it will continue to develop for many years after it is planted. With its elegant foliage and low maintenance requirements, the Otake Japanese Maple is an amazing choice for any garden.",https://perenual.com/storage/species_image/94_acer_palmatum_otake/og/2397px-Acer_palmatum_27Ben27Otake27_in_Auckland_Botanic_Gardens_02.jpg,6,6,https://perenual.com/api/hardiness-map?species_id=94&size=og&key=sk-3ksU68b046f66e1f912089
95,95,95,Otome Zakura Japanese Maple*,Acer palmatum 'Otome Zakura',,palmatum,Acer,Japan,tree,Perennial,"Grafting Propagation, Layering Propagation, Cutting, Air Layering Propagation, Root Division",Average,,days,"full sun, part shade","March, April, June, July, August, July, August, December, January, February",Low,Medium,False,"Otome Zakura Japanese Maple is a beautiful tree with springtime pink and white flowers, delicate green leaves in the summer, and fiery scarlet red foliage in the fall. It engages the garden with multi-sensorial beauty, providing breathtaking visuals and a pleasing scent. It's an easy to grow and maintain tree that doesn't require much pruning or other upkeep and can thrive in many different soil conditions. It's an especially lovely addition to a Japanese style garden and is sure to draw attention with its beauty and grandeur.",https://perenual.com/storage/species_image/95_acer_palmatum_otome_zakura/og/Leaves_of_Acer_palmatum_28200529.jpg,6,6,https://perenual.com/api/hardiness-map?species_id=95&size=og&key=sk-3ksU68b046f66e1f912089
96,96,96,Palmatifidum Japanese Maple*,Acer palmatum 'Palmatifidum',"Dissectum Paucum, Wahi-no-o",palmatum,Acer,Japan,tree,Perennial,"Grafting Propagation, Layering Propagation, Cutting, Air Layering Propagation, Root Division",Average,,days,"full sun, part shade","February, August, February, August, May",Low,Medium,False,"The Palmatifidum Japanese Maple (Acer palmatum 'Palmatifidum') is an amazing plant species with stunning foliage throughout the year. It has bright, deep red foliage in the spring, which gradually changes to a perfectly balanced mix of green and red in the summer. In fall, the leaves take on a golden yellow, highlighted with orange and red accents, making them truly breathtaking. Hardy and tolerant of most soils, Palmatifidum Japanese Maple adds interest to your garden without requiring a lot of effort. This species makes a perfect statement in any landscape, providing seasonal variation and color for years to come.",https://perenual.com/storage/species_image/96_acer_palmatum_palmatifidum/og/Acer_platanoides_27Palmatifidum27.jpg,6,6,https://perenual.com/api/hardiness-map?species_id=96&size=og&key=sk-3ksU68b046f66e1f912089
97,97,97,Peaches And Cream Japanese Maple,Acer palmatum 'Peaches And Cream',,palmatum,Acer,Japan,tree,Perennial,"Grafting Propagation, Layering Propagation, Cutting, Air Layering Propagation, Root Division",Frequent,"""7-10""",days,"full sun, part shade","February, May, June, July",Low,Medium,False,"Acer Palmatum 'Peaches and Cream' Japanese Maple is an amazing species of tree! It's a bold ornamental tree with a weeping habit and intense creamy yellow foliage in the summertime. Its leaves turn to a reddish pink in autumn and transform the landscape into a fairytale! Its wide sweeping canopy creates a wonderful, flowing arc and light dappled shade. It's sure to deliver artistic value to any garden, plus, its peachy pink flowers in the springtime make it an intriguing addition to your outdoor space. All in all, it's a beautiful, eye-catching tree with a multitude of seasonal colors that will create a stunning display.",,5,5,https://perenual.com/api/hardiness-map?species_id=97&size=og&key=sk-3ksU68b046f66e1f912089
98,98,98,Pendulum Julian Japanese Maple*,Acer palmatum 'Pendulum Julian',Julian Dissectum,palmatum,Acer,Japan,tree,Perennial,"Grafting Propagation, Layering Propagation, Cutting, Air Layering Propagation, Root Division",Frequent,,days,"full sun, part shade","May, June, July",Low,Moderate,False,"The Pendulum Julian Japanese Maple (Acer palmatum 'Pendulum Julian') is a beautiful and easy to care for maple tree. It has cascading branches which produce beautiful downwardly arching peach leaves in the spring, turning to beautiful deep green foliage in the summer and bright red leaves in the fall. Its slow growth rate makes it an ideal choice for small gardens and it is also frost-resistant. Whether you’re looking for a small tree for your patio or a larger tree for your garden, this maple tree is ideal. It offers all-season interest, with understated beauty and an easy maintenance schedule.",https://perenual.com/storage/species_image/98_acer_palmatum_pendulum_julian/og/Acer_palmatum_var._dissectum_27Inaba-shidare27.jpg,6,6,https://perenual.com/api/hardiness-map?species_id=98&size=og&key=sk-3ksU68b046f66e1f912089
99,99,99,Pink Lace Japanese Maple*,Acer palmatum 'Pink Lace',,palmatum,Acer,Japan,tree,Perennial,"Grafting Propagation, Layering Propagation, Cutting, Air Layering Propagation, Root Division",Frequent,,days,full sun,"December, January, February, March, April, May",Low,Moderate,False,"The Pink Lace Japanese Maple is a stunning small tree that packs a big visual punch. Its delicate and intricate lace-like foliage emerges tender pink in the spring and turns to a deep and lovely burgundy-red in the summer and falls months. In the winter months its cheerful pink branches are a great source of winter interest. It's a wonderful focal point for any garden and makes a great addition for a small urban space. Plus, its low maintenance needs mean it can thrive in any soil type or a range of temperatures and light exposures!",https://perenual.com/storage/species_image/99_acer_palmatum_pink_lace/og/Acer_palmatum_27Burgundy_lace_JPG1A.jpg,6,6,https://perenual.com/api/hardiness-map?species_id=99&size=og&key=sk-3ksU68b046f66e1f912089
100,100,100,Pixie Japanese Maple,Acer palmatum 'Pixie',,palmatum,Acer,Japan,tree,Perennial,"Air Layering Propagation, Grafting Propagation, Cutting, Division, Seed Propagation",Average,"""7-10""",days,"full sun, part shade","March, April, March, April, May, June, July, August, September, October, November",Low,Moderate,False,"Pixie Japanese Maple is an amazing ornamental shrub that will quickly make your garden shine with its unique structure and showy foliage. Its small, fern-like, deep-green leaves with a pinkish-red edge add to the eye-catching quality of this variety. It has an upright, bushy growth that reaches around 2 metres in height, making it an ideal choice for a low-maintenance ornamental plant. Pixie is also very tolerant of a variety of soils and climates, so it's an ideal choice for a range of garden situations. No matter where you grow it, you can expect bold colour from spring through to autumn - why not add this statement piece to your garden today?",https://perenual.com/storage/species_image/100_acer_palmatum_pixie/og/Acer_palmatum_27Oshio_beni27_-_JPG2.jpg,6,6,https://perenual.com/api/hardiness-map?species_id=100&size=og&key=sk-ACnv68b0630adff3b12096
101,101,101,Purple Ghost Japanese Maple*,Acer palmatum 'Purple Ghost',,palmatum,Acer,Japan,tree,Perennial,"Grafting Propagation, Layering Propagation, Cutting, Air Layering Propagation, Root Division",Average,"""3-4""",days,"full sun, part shade","March, April",Low,Medium,False,"The Purple Ghost Japanese Maple (Acer palmatum 'Purple Ghost') is an amazing plant species with its deep purple foliage, contrasting with its bright, white veins. It is a remarkable addition to any garden and it certainly deserves a place in your outdoor space. Its dramatic foliage turns brilliant yellow in the fall, adding excitement and beauty to the garden. Aside from its good looks, it is a hardy and low-maintenance species, so no need to worry about it taking up too much time. Compact and slow-growing, this plant is the perfect way to bring life, color, and personality to your garden.",https://perenual.com/storage/species_image/101_acer_palmatum_purple_ghost/og/6886992806_f55f1a8613_b.jpg,6,6,https://perenual.com/api/hardiness-map?species_id=101&size=og&key=sk-ACnv68b0630adff3b12096
102,102,102,Red Dragon Japanese Maple,Acer palmatum 'Red Dragon',,palmatum,Acer,Japan,tree,Perennial,"Grafting Propagation, Layering Propagation, Cutting, Air Layering Propagation, Root Division",Average,"""3-4""",days,"full sun, part shade","February, March, April",Low,Moderate,False,"The Red Dragon Japanese Maple (Acer palmatum 'Red Dragon') is an amazing and fascinating small tree. With red foliage in the summer, and vibrant orange and yellow in the fall, this tree will add a splash of color to any garden. When the sun hits it, the light reflects off of the red foliage producing a variety of beautiful tones and colors. The bark of this tree is also a sight to behold, as it is exfoliating and layered, giving it an almost fire-like texture. Its compact habit also makes it suitable for small gardens, adding depth and texture to any landscape.",https://perenual.com/storage/species_image/102_acer_palmatum_red_dragon/og/4847966614_089c83b489_b.jpg,6,6,https://perenual.com/api/hardiness-map?species_id=102&size=og&key=sk-kMpx68b02586bb61112084
103,103,103,Red Feathers Japanese Maple*,Acer palmatum 'Red Feathers',,palmatum,Acer,Japan,tree,Perennial,"Grafting Propagation, Layering Propagation, Cutting, Air Layering Propagation, Root Division",Average,"""3-4""",days,"full sun, part shade","February, March, April",Low,,False,"The Red Feathers Japanese Maple (Acer palmatum 'Red Feathers') is a beautiful and unique maple tree that is perfect for any garden. It has small, trilobate, green leaves with crimson red margins that transforms to a majestic deep burgundy during the summer and fall. Its impressive red and purple hues contrast elegantly against its bright green center. This hardy and low maintenance tree demands no more than a yearly pruning and water during dry periods, making it an easy staple in any backyard. Red Feathers Japanese Maple is definitely a stunning addition to any landscape.",https://perenual.com/storage/species_image/103_acer_palmatum_red_feathers/og/pexels-photo-8065044.jpg,6,6,https://perenual.com/api/hardiness-map?species_id=103&size=og&key=sk-kMpx68b02586bb61112084
104,104,104,Red Filigree Lace Japanese Maple,Acer palmatum 'Red Filigree Lace',,palmatum,Acer,Japan,tree,Perennial,"Grafting Propagation, Layering Propagation, Cutting, Air Layering Propagation, Root Division",Average,"""2-3""",days,"full sun, part shade","June, July, February, June, July, February",Low,Medium,False,"Red Filigree Lace Japanese Maple is an amazing garden tree that stands out for its remarkable beauty. It produces palmate, dissected leaves of copper red in the spring and summer, changing to vibrant scarlet red in the autumn and winter. This classy tree adds a unique texture to the whole garden, with its stunning seasonal foliage and cascading, lime-green branches that form a dainty, lacy look. It is easy to maintain and perfect for small gardens or in pots where its striking beauty can be appreciated. It is a joy to admire and its presence enhances the garden with style.",https://perenual.com/storage/species_image/104_acer_palmatum_red_filigree_lace/og/Crimson_Queen_Japanese_Maple_plants_growing_in_NJ_in_April.jpg,6,6,https://perenual.com/api/hardiness-map?species_id=104&size=og&key=sk-kMpx68b02586bb61112084
105,105,105,Dwarf Red Pygmy Japanese Maple,Acer palmatum 'Red Pygmy',,palmatum,Acer,Japan,tree,Perennial,"Grafting Propagation, Cutting, Layering Propagation, Air Layering Propagation, Root Division",Average,"""3-4""",days,"full sun, part shade","March, April, June, July, August",Low,Medium,False,"The Dwarf Red Pygmy Japanese Maple (Acer palmatum 'Red Pygmy') is an amazing addition to any garden with its captivating beauty. Its deep reds and purples make up its beautiful foliage, perfect for adding excitement and color to any landscape. Its small size and easy maintenance make it an ideal choice for even the smallest of gardens. It's the perfect size for small enclosures, patios, and paths and can remain evergreen in the winter months. The tree is slow-growing, making it long-lasting and resilient in the face of disease, extreme weather conditions, and pests. Enjoy the beauty of the changing colors year round and the umbrella-shaped canopy which provides much-needed shade, with this remarkable little tree.",https://perenual.com/storage/species_image/105_acer_palmatum_red_pygmy/og/800px-Acer_Palmatum_27Red_Pygmy27.jpg,6,6,https://perenual.com/api/hardiness-map?species_id=105&size=og&key=sk-kMpx68b02586bb61112084
106,106,106,Red Select Japanese Maple*,Acer palmatum 'Red Select',,palmatum,Acer,Japan,tree,Perennial,"Grafting Propagation, Layering Propagation, Cutting, Air Layering Propagation, Root Division",Frequent,,days,"full sun, part shade","February, March, April",Low,High,False,"Red Select Japanese Maple is an amazing species! It features a beautiful dense-spreading canopy with deep red-purple foliage, making it both a vibrant and attractive addition to any landscape. It is a low maintenance tree with minimal pruning or care needs. It can be grown in full sun or part shade, and prefers well-drained soil with some moisture. When its foliage changes from spring to summer, it’s a true delight. This versatile tree is an ideal choice for small gardens and makes a great specimen tree or container plant. Add a Red Select Japanese Maple to your landscape and enjoy its colorful beauty for years to come.",https://perenual.com/storage/species_image/106_acer_palmatum_red_select/og/Acer_palmatum_27Burgundy_lace_JPG1A.jpg,6,6,https://perenual.com/api/hardiness-map?species_id=106&size=og&key=sk-kMpx68b02586bb61112084
107,107,107,Rhode Island Red Japanese Maple,Acer palmatum 'Rhode Island Red',,palmatum,Acer,Japan,tree,Perennial,"Grafting Propagation, Layering Propagation, Cutting, Air Layering Propagation, Root Division",Average,"""7-10""",days,"full sun, part shade","February, March, April, March, April, May, June, July, August, September, May",Low,Medium,False,"The Rhode Island Red Japanese Maple is an amazing deciduous tree that boasts bright, lush red foliage throughout the summer, which turns to golden yellow in the fall. The small tree grows slowly, reaching only 15 feet in height and can easily be contained with pruning. It’s compact size and full round shape makes it an ideal choice for smaller garden spaces. It also features slim green stems with delicate, 5-lobed leaves. The Acer palmatum 'Rhode Island Red' is easy to maintain and provides a beautiful, brilliant focal point in any landscape.",https://perenual.com/storage/species_image/107_acer_palmatum_rhode_island_red/og/16805737339_d92eafd674_b.jpg,5,5,https://perenual.com/api/hardiness-map?species_id=107&size=og&key=sk-kMpx68b02586bb61112084
108,108,108,Ruby Ridge Japanese Maple*,Acer palmatum 'Ruby Ridge',,palmatum,Acer,Japan,tree,Perennial,"Grafting Propagation, Layering Propagation, Cutting, Air Layering Propagation, Root Division",Average,"""3-4""",days,"full sun, part shade","May, June, July, March, April, May, June, July, August, September",Low,Medium,False,"The Ruby Ridge Japanese Maple (Acer palmatum 'Ruby Ridge') is an amazing plant species renowned for its exceptional foliage beauty. Its vibrant foliage spreads out in a shapely, broad and upright form. Averaging 8–10 feet tall and 9–11 feet wide, its crimson-red leaves are deeply divided, adding a unique texture and visual interest, perfect for any outdoor space. Through the summer the leaves deepen to a rich burgundy and then turn vibrant orange to fiery red shades in the fall. Not to mention, Ruby Ridge Japanese Maples are highly adaptable and easy to care for, making them a great choice for novice gardeners.",https://perenual.com/storage/species_image/108_acer_palmatum_ruby_ridge/og/sk3776-image-kwvuoab1.jpg,5,5,https://perenual.com/api/hardiness-map?species_id=108&size=og&key=sk-kMpx68b02586bb61112084
109,109,109,Ruby Stars Japanese Maple*,Acer palmatum 'Ruby Stars',,palmatum,Acer,Japan,tree,Perennial,"Grafting Propagation, Cutting, Layering Propagation, Air Layering Propagation, Root Division",Average,"""3-4""",days,"full sun, part shade","February, March, April, May",Low,Medium,False,"Ruby Stars Japanese Maple is an amazing small tree with a unique look. With its bright, coral-red foliage all year round and its delicate, layered, lacy branches, it's sure to be an attractive addition to any garden. This low maintenance tree requires little pruning and produces very little surface roots when grown in an appropriately-sized container. Its striking, star-like foliage will bring an element of color and movement to any space. Ruby Stars Japanese Maple is a showstopper, sure to make any garden more beautiful.",,5,5,https://perenual.com/api/hardiness-map?species_id=109&size=og&key=sk-kMpx68b02586bb61112084
110,110,110,Ruslyn In The Pink Japanese Maple,Acer palmatum 'Ruslyn In The Pink',,palmatum,Acer,Japan,tree,Perennial,"Grafting Propagation, Layering Propagation, Cutting, Air Layering Propagation, Root Division",Frequent,,days,"part sun/part shade, part shade","March, April, August, December, January, February",Low,Medium,False,"The Ruslyn In The Pink Japanese Maple is an absolutely stunning tree with its vibrant hues of deep greens and vibrant pinks. It's an ideal choice for landscape planters and gardeners who are looking for a beautiful tree that will add a colorful accent to any outdoor space. Its leaves change color throughout the season, from dark greens during the summer months to yellows and pinks as the season progresses. In the fall and winter, the tree's leaves become dark red, giving any landscape an interesting contrast of colors. This variety of Japanese Maple tree is easy to care for, and its unique and vibrant foliage is a perfect delight for any garden.",https://perenual.com/storage/species_image/110_acer_palmatum_ruslyn_in_the_pink/og/Acer_palmatum_var_amoenum_cv_Sanguineum2.jpg,5,5,https://perenual.com/api/hardiness-map?species_id=110&size=og&key=sk-kMpx68b02586bb61112084
111,111,111,Ryusen Japanese Maple,Acer palmatum 'Ryusen',,palmatum,Acer,Japan,tree,Perennial,"Grafting Propagation, Cutting, Layering Propagation, Air Layering Propagation, Root Division",Average,"""3-4""",days,"full sun, part shade","March, April, May, March, April, May, February, June, July, August",Low,Moderate,False,"Ryusen Japanese Maple (Acer palmatum 'Ryusen') is an amazing tree that is perfect for adding beauty and interest to any garden. Its green and yellow coloration, together with its layered and lacy structure, create truly remarkable works of art-like scenery. This magnificent tree can tolerate both full and partial sun and does not need excessive watering or pruning to thrive. Its small size and fascinating foliage make this an ideal choice for small yards or patio containers. Ryusen Japanese Maple showcases year-round interest with its colorful foliage, delicate shape, and interesting texture. With its ancient charm, it is the perfect addition to a garden and sure to bring a lifetime of joy to the home.",https://perenual.com/storage/species_image/111_acer_palmatum_ryusen/og/26170793293_62330077e4_b.jpg,6,6,https://perenual.com/api/hardiness-map?species_id=111&size=og&key=sk-ACnv68b0630adff3b12096
112,112,112,Sagara Nishiki Japanese Maple,Acer palmatum 'Sagara Nishiki',,palmatum,Acer,Japan,tree,Perennial,"Grafting Propagation, Layering Propagation, Cutting, Air Layering Propagation, Root Division",Average,"""3-4""",days,"full sun, part shade","February, March, April",Low,Medium,False,"The Sagara Nishiki Japanese Maple is an amazing tree. Its unique and delicate foliage is stunning, with variegated yellow and green leaves streaked with bright pink and creamy white. In spring and fall, the trees display stunning red blooms. This beautiful tree is hardy and can withstand temperatures as low as minus 15° Fahrenheit, making it an excellent choice for cooler climates. It also sports an upright growth habit and medium size, making it a great choice for front yards, patios, and gardens. Its lovely foliage, low maintenance, and cold tolerance make the Sagara Nishiki Japanese Maple one of the most sought after trees in landscaping.",,6,6,https://perenual.com/api/hardiness-map?species_id=112&size=og&key=sk-ACnv68b0630adff3b12096
113,113,113,Samurai Sword Japanese Maple,Acer palmatum 'Samarzam',,palmatum,Acer,Japan,tree,Perennial,"Grafting Propagation, Layering Propagation, Cutting, Air Layering Propagation, Root Division",Average,"""7-10""",days,"full sun, part shade","February, March, April, March, April, May, June, July, August, September, June, July, August, May",Low,Medium,False,"The Samurai Sword Japanese Maple (Acer palmatum 'Samarzam') is an amazing plant species. It is a small, deciduous tree with bright green foliage that turns to a dazzling reddish-purple in the summer and a vibrant red in the fall. It has remarkable, upright, fan-like, lobed leaves and is widely admired for its beauty, uniqueness and striking texture. Known for its resistance to disease and strong stem, the Samurai Sword Japanese Maple is perfect for any landscape. Its amazing texture and color make it an ideal specimen or accent tree for a garden.",https://perenual.com/storage/species_image/113_acer_palmatum_samarzam/og/sk3776-image-kwvuoab1.jpg,5,5,https://perenual.com/api/hardiness-map?species_id=113&size=og&key=sk-ACnv68b0630adff3b12096
114,114,114,Coral Bark Japanese Maple,Acer palmatum 'Sango Kaku',,palmatum,Acer,Japan,tree,Perennial,"Grafting Propagation, Cutting, Layering Propagation, Air Layering Propagation, Root Division",Average,"""3-4""",days,"full sun, part shade","March, April",Moderate,Medium,False,"The Coral Bark Japanese Maple (Acer palmatum 'Sango Kaku') is an amazing plant. Its bright coral-red bark and green foliage create a stunning contrast, making it a statement piece in any landscape. The bright scarlet color of the bark further develops into a deep red shade as the season progresses. The lush green leaves, in turn, turn various shades of yellow and orange in the fall. It’s easy to maintain and relatively pest-free, making it a great option for anyone looking for a beautiful yet low-maintenance tree. Its slow-growing nature allows it to fit into almost any size garden. With proper care, its beauty can last for generations.",https://perenual.com/storage/species_image/114_acer_palmatum_sango_kaku/og/50036749928_86277e5884_b.jpg,6,6,https://perenual.com/api/hardiness-map?species_id=114&size=og&key=sk-ACnv68b0630adff3b12096
