id,general_plant_id,threatened_plant_id,common_name,scientific_name,other_name,species_epithet,genus,origin,type,cycle,propagation,watering,watering_benchmark,watering_unit,sunlight,pruning_month,growth_rate,care_level,medicinal,description,image_url,hardiness_min,hardiness_max,hardiness_map_url
1,1,1,European Silver Fir,Abies alba,Common Silver Fir,alba,Abies,"Austria, Germany, Switzerland, France, Italy, Slovenia, Croatia, Bosnia and Herzegovina, Serbia, Montenegro, Albania, Bulgaria, Romania, Ukraine, Poland, Czech Republic, Slovakia, Hungary",tree,Perennial,"Cutting, Grafting Propagation, Layering Propagation, Seed Propagation, Air Layering Propagation, Tissue Culture",Frequent,"""7-10""",days,full sun,"February, March, April",High,Medium,True,"European Silver Fir (Abies alba) is an amazing coniferous species native to mountainous regions of central Europe and the Balkans. It is an evergreen tree with a narrow, pyramidal shape and long, soft needles. Its bark is scaly grey-brown and its branches are highly ornamental due to its conical-shaped silver-tinged needles. It is pruned for use as an ornamental evergreen hedging and screening plant, and is also popular for use as a Christmas tree. Young trees grow quickly and have strong, flexible branches which makes them perfect for use as windbreaks. The European Silver Fir is an impressive species, making it ideal for gardens and public spaces.",https://perenual.com/storage/species_image/1_abies_alba/og/1536px-Abies_alba_SkalitC3A9.jpg,7,7,https://perenual.com/api/hardiness-map?species_id=1&size=og&key=sk-3ksU68b046f66e1f912089
2,2,2,Pyramidalis Silver Fir,Abies alba 'Pyramidalis',,alba,Abies,"Austria, Germany, Switzerland, Italy, France, Slovenia, Croatia",tree,Perennial,"Cutting, Grafting Propagation, Layering Propagation, Seed Propagation",Average,"""7-10""",days,full sun,"February, March, April",Low,Medium,False,"Pyramidalis Silver Fir (Abies alba 'Pyramidalis') is an amazing coniferous tree species. Its narrow, elegant pyramidal shape makes it ideal for landscapes with limited space. This species features bright silver-green foliage year-round and distinctive yellowish brown cones that hold its unique shape for years. It also displays purple-tinged shoots in the spring and a showy red bark in the winter. Its slow growth and hardiness make it an ideal addition to any landscape. The Pyramidalis Silver Fir also requires minimal maintenance and can be an excellent companion for many other plants in the garden. From small yards to large gardens, this species will create a majestic and interesting landscape.",https://perenual.com/storage/species_image/2_abies_alba_pyramidalis/og/49255769768_df55596553_b.jpg,4,4,https://perenual.com/api/hardiness-map?species_id=2&size=og&key=sk-3ksU68b046f66e1f912089
3,3,3,White Fir,Abies concolor,"Silver Fir, Concolor Fir, Colorado Fir",concolor,Abies,"Western United States, Mexico",tree,Perennial,"Seed Propagation, Hardwood Cuttings",Average,"""7-10""",days,"Full sun, part shade","February, March, April",Low,Moderate,True,"White Fir (Abies concolor) is an amazing evergreen tree species found in the western United States. It has a distinct white bark that fades to a yellowish hue on the lower branches and a graceful, conical shape. The beautiful Blue-green needles of White Fir are soft and tufted at the end and release a pleasant Christmas-like aroma when crushed. This sturdy species can grow up to 300 feet tall and over 140 years old, making it one of the longest living species in the world. It is highly adaptable, drought-tolerant, and very low maintenance with minimal pruning requirements. White Fir is an excellent choice for privacy screens, windbreaks, and living Christmas trees.",https://perenual.com/storage/species_image/3_abies_concolor/og/52292935430_f4f3b22614_b.jpg,3,3,https://perenual.com/api/hardiness-map?species_id=3&size=og&key=sk-3ksU68b046f66e1f912089
4,4,4,Candicans White Fir,Abies concolor 'Candicans',"Silver Fir, Concolor Fir, Colorado Fir",concolor,Abies,United States,tree,Perennial,"Cutting, Grafting Propagation, Layering Propagation, Air Layering Propagation, Seed Propagation",Average,"""7-10""",days,full sun,"February, June, July, February, June, July",Low,Medium,False,"Candicans White Fir is one of the most amazing species of fir tree. Its vibrant, powdery-white needles make it a real show-stopper in the winter and spring. The light color is also resistant to bronzing or discoloration, so the brilliant hue is maintained for many years. It also has a unique branch structure with a strong central leader and shorter lateral branches creating an eye-catching silhouette. This species is hardy and tolerant to a variety of soil types, making it a great choice for difficult areas. Its fast growth rate creates an impressive display quickly, making it an excellent choice to add curb appeal to your landscape.",https://perenual.com/storage/species_image/4_abies_concolor_candicans/og/49283844888_332c9e46f2_b.jpg,4,4,https://perenual.com/api/hardiness-map?species_id=4&size=og&key=sk-3ksU68b046f66e1f912089
5,5,5,Fraser Fir,Abies fraseri,Southern Fir,fraseri,Abies,Southeastern United States,tree,Perennial,"Seed Propagation, Seed Propagation, Seed Propagation, Cutting, Grafting Propagation, Layering Propagation, Tissue Culture",Frequent,"""6-12""",days,"full sun, part shade, filtered shade","February, March, April, June, July, August",Moderate,Medium,False,"The Fraser Fir (Abies fraseri) is an amazing tree species with many great qualities. It is a dense evergreen conifer native to the Appalachian mountains. Its pyramidal shape and glossy dark green needles, that curve upward, make it a beautiful and popular Christmas tree. Its needles are short, soft, flat and pleasant to the touch. It has been found to be highly resistant to pests, diseases, and environmental stress. Additionally, it has superior winter hardiness and a strong wood that produces very little sap. This incredible species is perfect for a variety of evergreen applications and is guaranteed to bring a unique and beautiful look to any landscape.",https://perenual.com/storage/species_image/5_abies_fraseri/og/36843539702_e80fc436e0_b.jpg,6,6,https://perenual.com/api/hardiness-map?species_id=5&size=og&key=sk-3ksU68b046f66e1f912089
6,6,6,Golden Korean Fir,Abies koreana 'Aurea',,koreana,Abies,North and South Korea,tree,Perennial,"Cutting, Grafting Propagation, Layering Propagation, Seed Propagation, Air Layering Propagation",Average,"""7-10""",days,"Full sun, part shade","June, May",Low,Medium,False,"The Golden Korean Fir is truly awe inspiring. Its stunning golden-green foliage and soft pink cones make it a majestic wonder to behold. This evergreen tree grows quickly and is remarkably tough and resistant to brittleness. Its branches form a distinctive cone shape that gives it a modern, contemporary look. Its needles are soft and full of pleasant aroma. This amazing specimen requires minimal maintenance and is an ideal focal point for landscaping and garden design. Its unique foliage, easy upkeep and attitude of durability make it a stunning and reliable addition to any garden.",https://perenual.com/storage/species_image/6_abies_koreana_aurea/og/49235570926_99ec10781d_b.jpg,6,6,https://perenual.com/api/hardiness-map?species_id=6&size=og&key=sk-3ksU68b046f66e1f912089
7,7,7,Alpine Fir,Abies lasiocarpa,"Subalpine Fir, Rocky Mountain Fir",lasiocarpa,Abies,"Canada, United States, Mexico, Guatemala, Honduras, El Salvador, Nicaragua, Costa Rica, Panama",tree,Perennial,"Seed Propagation, Cutting, Grafting Propagation, Layering Propagation, Division",Average,"""7-10""",days,"full sun, part shade","February, March, April",Low,Medium,False,"The Alpine Fir, scientifically known as Abies lasiocarpa, is an amazing conifer native to western North America. Its stiff, dense needles bring vivid color year-round and its pyramidal growth habit adds texture and interest to any landscape. With its tolerance to a variety of soils and conditions, this evergreen is both versatile and visually striking. Its branches reach out and cast a unique evergreen form of showy clouds. Through years of growth, it develops a sturdy trunk and crooked branches that are quite striking. Alpine Fir also provides winter cover and shelter for wildlife. Its dense needles are an ideal refuge from cold and precipitation. Its strong branches and trunk also provide perching points for nesting birds. Alpine Fir is truly one of nature’s most diverse and visually stunning plants.",https://perenual.com/storage/species_image/7_abies_lasiocarpa/og/51002756843_74fae3c2fa_b.jpg,2,2,https://perenual.com/api/hardiness-map?species_id=7&size=og&key=sk-3ksU68b046f66e1f912089
8,8,8,Blue Spanish Fir,Abies pinsapo 'Glauca',Glaucous Spanish Fir,pinsapo,Abies,Southern Spain,tree,Perennial,"Cutting, Grafting Propagation, Layering Propagation, Seed Propagation",Average,"""7-10""",days,"Full sun, part shade","March, April, June, July, August, March, April, May, June, July, August",Low,Medium,False,"The Blue Spanish Fir (Abies pinsapo 'Glauca') is an amazing plant that is native to the mountains of southern Spain. Its beautiful blue needle-like foliage and pyramidal shape set it apart from other coniferous trees. This tree is an extremely hardy species, and can survive temperatures as low as -20 Fahrenheit. It is also incredibly drought tolerant, but will thrive with regular watering in the summer. Its striking blue color makes it the perfect accent to any landscaping design, adding a pop of color to your garden. It is also surprisingly fast-growing, making it ideal for creating a privacy screen quickly. All in all, the Blue Spanish Fir is an amazing plant that can bring year-round beauty to any garden!",https://perenual.com/storage/species_image/8_abies_pinsapo_glauca/og/21657514018_c0d9fed9f4_b.jpg,7,7,https://perenual.com/api/hardiness-map?species_id=8&size=og&key=sk-3ksU68b046f66e1f912089
9,9,9,Noble Fir,Abies procera,"Red Fir, White Fir",procera,Abies,"United States, Canada, Mexico, Central America, South America",tree,Perennial,"Seed Propagation, Cutting, Grafting Propagation, Layering Propagation, Air Layering Propagation",Average,"""7-10""",days,full sun,"February, March, April",Low,Medium,True,"The Noble Fir (Abies procera) is an amazing species in many ways. It is a tall and stately tree with a beautiful, conical shape; its symmetrical branches are heavily laden with needles that range from a deep, glossy green to a deep blue-green. It has a thick, scaly bark and splendid foliage that make it an ideal choice for any garden. Its wide, dense growth provides shelter to wildlife, while its strong branches provide it with excellent resistance to windstorms. The Noble Fir is a long-lasting species with impressive longevity, making it a great addition to any landscape. With its majestic form, lush color, and great strength, the Noble Fir is a remarkable species that will enhance any outdoor space.",https://perenual.com/storage/species_image/9_abies_procera/og/49107504112_6bd7effb8b_b.jpg,8,8,https://perenual.com/api/hardiness-map?species_id=9&size=og&key=sk-3ksU68b046f66e1f912089
10,10,10,Johin Japanese Maple,Acer 'Johin',Red Full Moon Maple,'Johin',Acer,Japan,tree,Perennial,"Air Layering Propagation, Grafting Propagation, Cutting, Division, Seed Propagation",Average,"""7-10""",days,"full sun, part shade","March, April",Low,Medium,False,"The Johin Japanese Maple (Acer 'Johin') is a one-of-a-kind variety with incredible foliage that's sure to turn heads. It stands out from the crowd with its bright yellow-green colored leaves, framed by a deep green margin. Mature trees usually have a beautiful, gnarled trunk, making it an ideal choice for bonsai enthusiasts. In the spring, its delicate white flowers add an extra layer of beauty, before the dramatic autumn hues of red, yellow and orange set in. It's an easy-to-care-for, slow-growing tree that becomes even more stunning with age. Perfect for home gardens, patio or courtyard spaces, it's no wonder the Johin Japanese Maple is so popular.",https://perenual.com/storage/species_image/10_acer_johin/og/pexels-photo-2183508.jpg,6,6,https://perenual.com/api/hardiness-map?species_id=10&size=og&key=sk-3ksU68b046f66e1f912089
11,11,11,Snakebark Maple,Acer davidii,"Father David's Maple, Pere David's Maple",davidii,Acer,"China, Myanmar",tree,Perennial,"Grafting Propagation, Layering Propagation, Cutting, Seed Propagation",Average,"""3-4""",days,"Full sun, part shade","March, April",Low,Medium,True,"The Snakebark Maple (Acer davidii) is an amazing tree, beloved by gardeners. It features beautiful gills, which are handsomely striped with tiger-like markings. In the summer, its leaves turn to a bright golden hue and its bark remains smooth, with a distinctive mottled ash-gray coloration. Plant it in a sunny spot to take full advantage of its leaves, which are said to produce a calming effect. It is also low maintenance and very tolerant of the cold, surviving through temperatures as low as -25°F. With its stunning shape and amazing color, the Snakebark Maple is a wonderful addition to any landscape!",https://perenual.com/storage/species_image/11_acer_davidii/og/6868591754_f4ac5b0510_b.jpg,6,6,https://perenual.com/api/hardiness-map?species_id=11&size=og&key=sk-3ksU68b046f66e1f912089
12,12,12,Amur Maple,Acer ginnala,,ginnala,Acer,"China, North Korea, Russia, Mongolia",tree,Perennial,"Cutting, Grafting Propagation, Layering Propagation, Air Layering Propagation, Seed Propagation",Average,,days,"full sun, part shade","February, February, March",Low,Moderate,False,"The Amur Maple is a beautiful and versatile species of tree that are perfect for any property. With its vibrant green buds and star-shaped leaves that turn yellow and orange in the autumn, this stunning tree makes for a spectacular backdrop in any yard or garden. Its dense growth provides ample shade and its smaller size means it won't take up too much space. The Amur Maple is also highly resilient, resistant to extreme temperatures and insect diseases and does well in most soils. This hardy and majestic tree will bring years of beauty to your lawn and garden.",https://perenual.com/storage/species_image/12_acer_ginnala/og/10476032513_76ca899bc4_b.jpg,2,2,https://perenual.com/api/hardiness-map?species_id=12&size=og&key=sk-3ksU68b046f66e1f912089
13,13,13,Flame Amur Maple,Acer ginnala 'Flame',,ginnala,Acer,"China, North Korea, Russia, Japan",tree,Perennial,"Cutting, Grafting Propagation, Layering Propagation, Air Layering Propagation, Stooling, Root Division",Frequent,"""7-10""",days,full sun,"February, March, April, May",High,Moderate,False,"The Flame Amur Maple is an amazing plant species perfect for any landscape. It's small to medium size, with a mature height of 15 to 20 feet, makes it perfect for tight spaces in gardens, parks, or yards. Its bright orange-red buds make a striking statement in the spring, and its leaves are a beautiful deep green in summer. In fall, the foliage turns a striking array of red, yellow and orange colors giving a brilliant splash to the landscape. It's very hardy, tolerating most soil types, and can adapt to various climates, making it a great addition to any home garden.",https://perenual.com/storage/species_image/13_acer_ginnala_flame/og/pexels-photo-1649190.jpg,3,3,https://perenual.com/api/hardiness-map?species_id=13&size=og&key=sk-3ksU68b046f66e1f912089
14,14,14,Red Rhapsody Amur Maple,Acer ginnala 'Mondy',,ginnala,Acer,China,tree,Perennial,"Cutting, Grafting Propagation, Layering Propagation, Air Layering Propagation, Tissue Culture",Frequent,"""7-10""",days,"full sun, part shade","February, March, April",High,Moderate,False,"The Red Rhapsody Amur Maple (Acer ginnala ‘Mondy’) is a stunning and unique addition to any garden. With its brilliant red foliage, this maple species is a captivating sight in the spring and fall. The tree is also not as large as other maple varieties, making it an ideal choice for small gardens and yards. It thrives in varied soil conditions and can survive temperatures down to -30F. This resilient tree can last for many years and provides welcome shade during the warm summer months. The Red Rhapsody Amur Maple is a stunning and unique tree for any garden and promises a vibrant splash of color throughout the entire year.",https://perenual.com/storage/species_image/14_acer_ginnala_mondy/og/pexels-photo-1789879.jpg,2,2,https://perenual.com/api/hardiness-map?species_id=14&size=og&key=sk-3ksU68b046f66e1f912089
15,15,15,Ruby Slippers Amur Maple,Acer ginnala 'Ruby Slippers',,ginnala,Acer,China,tree,Perennial,"Cutting, Grafting Propagation, Layering Propagation, Air Layering Propagation, Root Division",Frequent,"""7-10""",days,"full sun, part shade","May, June, July",Low,,False,"Ruby Slippers Amur Maple is an amazing plant species that can survive in extreme conditions. It has a unique vertical habit, clockwise foliage, and bright red stems which makes it a great ornamental tree. Its deep green summer foliage with a pattern of creamy white margins, plus its eye-catching red stem color in the fall and winter give this plant unique beauty. It is fast-growing and tolerates extreme heat, drought, and cold temperatures. It also thrives in a variety of soils and can handle little maintenance. So, Ruby Slippers Amur Maple is an amazing species to have in your garden, adding beauty and color all year round.",https://perenual.com/storage/species_image/15_acer_ginnala_ruby_slippers/og/pexels-photo-1640820.jpg,3,3,https://perenual.com/api/hardiness-map?species_id=15&size=og&key=sk-3ksU68b046f66e1f912089
16,16,16,Paperbark Maple,Acer griseum,,griseum,Acer,Central and eastern China,tree,Perennial,"Seed Propagation, Greenwood Cuttings, Hardwood Cuttings",Average,"""3-4""",days,"Full sun, part shade","March, April, August, March, April, August",Low,Medium,False,"Paperbark Maple (Acer griseum) is a truly amazing tree. With its unique cinnamon-color bark that peels in thin layers and its delicate foliage, it is a sight to behold in any garden. In spring, the tree features delicate pink and white flowers. The foliage turns a copper-bronze color in the fall, making it a great ornamental tree year-round. Paperbark Maple is also low-maintenance and easy to grow, making it an ideal choice for a sheltered spot in your garden. It is also a great option for a screen near a patio or pool. The Paperbark Maple is a beautiful and versatile must-have for any garden.",https://perenual.com/storage/species_image/16_acer_griseum/og/5158906371_ed08a86876_b.jpg,5,5,https://perenual.com/api/hardiness-map?species_id=16&size=og&key=sk-3ksU68b046f66e1f912089
17,17,17,Fullmoon Maple,Acer japonicum,,japonicum,Acer,"Japan, Kuril Islands",tree,Perennial,"Air Layering Propagation, Grafting Propagation, Cutting, Division, Seed Propagation",Average,"""3-4""",days,"Full sun, part shade","February, March, April, May",Low,Medium,False,"The Fullmoon Maple is a spectacular deciduous shrub native to Japan, Korea and parts of China. It features an incredible round, bright yellow foliage in spring and summer that turns rich oranges and reds in the fall. Its unique shape gives it a wonderful presence in the garden, while its attractive bark is marked with orange and dark brown hues. For added attraction in the garden, the Fullmoon Maple is renowned for its stunning white flowers with yellow centers, which bloom from late spring until early summer. Its beautiful foliage, stunning flowers and interesting bark make the Fullmoon Maple an amazing garden addition for any landscape.",https://perenual.com/storage/species_image/17_acer_japonicum/og/7175475239_52543c51b3_b.jpg,6,6,https://perenual.com/api/hardiness-map?species_id=17&size=og&key=sk-3ksU68b046f66e1f912089
18,18,18,Cutleaf Fullmoon Maple,Acer japonicum 'Aconitifolium',fernleaf full moon maple,japonicum,Acer,"S.E. Asia, Japan, China",tree,Perennial,"Cutting, Grafting Propagation",Average,"""7-10""",days,"Full sun, part shade","March, April, June, July, August",Moderate,Medium,False,"The Cutleaf Fullmoon Maple is one of nature's most beautiful trees. Its intricate, delicate leaves have deep lobes and unique lobing patterns- each one showing its own distinct character. Its light silvery-green foliage turns a golden yellow in fall. The Cutleaf Fullmoon Maple produces long, elegant branches with large, full flowers that shimmer in the moonlight. In spring, the foliage emerges in a brilliant array of soft pinks, whites, and yellows. This eye-catching display gives this tree its name- Cutleaf Fullmoon Maple. Combined with beautiful bark that takes on an attractive whitish hue, this tree is sure to be a stunning addition to any garden.",https://perenual.com/storage/species_image/18_acer_japonicum_aconitifolium/og/23528789198_c419363323_b.jpg,6,6,https://perenual.com/api/hardiness-map?species_id=18&size=og&key=sk-3ksU68b046f66e1f912089
19,19,19,Attaryi Fullmoon Maple*,Acer japonicum 'Attaryi',,japonicum,Acer,Japan,tree,Perennial,"Grafting Propagation, Cutting, Layering Propagation, Air Layering Propagation, Tissue Culture",Average,,days,"full sun, part shade",February,High,High,False,"Attaryi Fullmoon Maple is an amazing ornamental tree that provides breathtaking visual impact throughout the year. Its young foliage emerges a bright pink hue in spring, fades to a golden yellow in summer and transforms to a spectacular burnt orange in autumn. This spectacular show, combined with the graceful weeping branches and deep mahogany bark, makes it an ideal focal point in outdoor landscapes. Attaryi Fullmoon Maple is also known for its drought tolerance, making it an adaptable choice for gardeners of all levels. Best of all, its ability to thrive in just about any soil and pH makes it an excellent addition to any garden.",https://perenual.com/storage/species_image/19_acer_japonicum_attaryi/og/pexels-photo-669323.jpg,6,6,https://perenual.com/api/hardiness-map?species_id=19&size=og&key=sk-3ksU68b046f66e1f912089
20,20,20,Golden Fullmoon Maple,Acer japonicum 'Aureum',,japonicum,Acer,Japan,tree,Perennial,"Air Layering Propagation, Grafting Propagation, Cutting, Division, Seed Propagation",Average,"""7-10""",days,"full sun, part shade","February, March, April, March, April, May, June, July, August, September",Low,Medium,False,"The Golden Fullmoon Maple is an amazing plant species due to its dazzling yellow-gold leaves, which scintillate in the sun. This tree is a sight to behold, especially in autumn, when the leaves turn a richer golden color. Its bark is smooth and light in color and its branches are gently curved and attractively shaped. This species of maple is easy to grow and thrives in full sun or partial shade, along with well-drained, fertile soil. It is also resistant to most pests and diseases, making it an ideal choice for the garden or backyard. With its graceful form and beautiful leaves, the Golden Fullmoon Maple is truly a stand-out in the landscape.",https://perenual.com/storage/species_image/20_acer_japonicum_aureum/og/2560px-Acer_shirasawanum_27Aureum27.jpg,6,6,https://perenual.com/api/hardiness-map?species_id=20&size=og&key=sk-3ksU68b046f66e1f912089
21,21,21,Emmett's Pumpkin Fullmoon Maple,Acer japonicum 'Emmett's Pumpkin',,japonicum,Acer,Japan,tree,Perennial,"Grafting Propagation, Cutting, Layering Propagation, Air Layering Propagation, Tissue Culture",Average,,days,"full sun, part shade, filtered shade","March, April, May, June, July",Low,,False,"Emmett's Pumpkin Fullmoon Maple is an amazing deciduous tree species that is known for its beautiful foliage. It has dark green, almost bronze-colored leaves that turn a deep orange-red in the fall. In the summertime, it has clusters of yellow-orange flowers, and in the winter it features small, red seed plumes. It grows in a pleasing, rounded shape and reaches heights up to 25 feet, providing year-round beauty to any landscape. It is a great choice for gardeners who are looking for a unique tree that provides stunning colors throughout the seasons.",https://perenual.com/storage/species_image/21_acer_japonicum_emmetts_pumpkin/og/Acer_shirasawanum_28golden_fullmoon_maple29_2_284633285838129.jpg,6,6,https://perenual.com/api/hardiness-map?species_id=21&size=og&key=sk-3ksU68b046f66e1f912089
22,22,22,Green Cascade Maple,Acer japonicum 'Green Cascade',,japonicum,Acer,Japan,tree,Perennial,"Air Layering Propagation, Grafting Propagation, Cutting, Division, Seed Propagation",Average,"""7-10""",days,"Full sun, part shade","February, March, April",Low,Medium,False,"The Green Cascade Maple (Acer japonicum 'Green Cascade') is an amazing plant with stunning features. It has a unique cascading form which means it is slightly wider at the base and gradually narrows as it grows taller. The foliage of this tree is deep green with reddish-tinged edges in the spring and summer, transforming to a deep yellow-green in autumn. This foliage provides a beautiful contrast with the bark which is grey-brown with a light orange tone. The Green Cascade Maple is an excellent choice for a specimen tree or to provide a natural screen. It's versatile, easy to care for, and provides stunning visual appeal all year round.",https://perenual.com/storage/species_image/22_acer_japonicum_green_cascade/og/4847225395_2509ee2bfe_b.jpg,6,6,https://perenual.com/api/hardiness-map?species_id=22&size=og&key=sk-3ksU68b046f66e1f912089
