id,general_plant_id,threatened_plant_id,common_name,scientific_name,other_name,species_epithet,genus,origin,type,cycle,propagation,watering,watering_benchmark,watering_unit,sunlight,pruning_month,growth_rate,care_level,medicinal,description,image_url,hardiness_min,hardiness_max,hardiness_map_url
292,292,292,Franklin Tree,Franklinia alatamaha,Franklinia Tree,alatamaha,Franklinia,Southeastern United States,tree,Perennial,"Seed Propagation, Cutting, Grafting Propagation, Layering Propagation, Air Layering Propagation",Average,"""3-4""",days,"full sun, part shade","February, May",Low,Medium,False,"The Franklin Tree is a truly amazing plant species found near the banks of the Altamaha River in Georgia. Its beautiful, large white and pink flowers are an incredible sight in the summer and autumn, providing a stunning contrast to the lush green foliage. Its fragrant blooms have an unforgettable scent that is pleasant and inviting. The foliage offers warmth and protection in the colder months, changing to yellow and orange shades in the autumn, and shedding leaves throughout the winter. It’s an incredibly hardy tree, making it ideal for lawns, gardens and parks; it be used in a variety of landscaping projects. All in all, the Franklin Tree is a wonderful plant that should be cherished and appreciated for its unique beauty and unique features.",https://perenual.com/storage/species_image/292_franklinia_alatamaha/og/36261306500_b5a32c9770_b.jpg,6,6,https://perenual.com/api/hardiness-map?species_id=292&size=og&key=sk-kMpx68b02586bb61112084
293,293,293,Fallgold Black Ash,Fraxinus nigra 'Fallgold',swamp ash,nigra,Fraxinus,Canada,tree,Perennial,Cutting,Average,"""3-4""",days,"full sun, part sun/part shade","December, January, February, March, April, May, June, July, August, December, January, February",Moderate,Medium,False,"The Fallgold Black Ash (Fraxinus nigra 'Fallgold') is an excellent shade tree for any garden or landscape. It is a tall, upright tree that produces stunning seasonal colors for fall and winter, ranging from yellow and bronze to purple. They have an impressive spread of 12-25 feet and can reach heights of up to 50 feet tall. This is a beautiful, hardy tree that can tolerate a wide range of soil conditions. They are also very tolerant of drought, making them an ideal choice for locations with little water access. It has a moderate growth rate, adding visual interest while still maintaining a small profile. Fallgold Black Ash is an amazing species that can bring a natural dynamic to any garden.",https://perenual.com/storage/species_image/293_fraxinus_nigra_fallgold/og/8740535204_aa4b907d99_b.jpg,2,2,https://perenual.com/api/hardiness-map?species_id=293&size=og&key=sk-kMpx68b02586bb61112084
294,294,294,Leprechaun Green Ash,Fraxinus pennsylvanica 'Leprechaun',Red Ash,pennsylvanica,Fraxinus,North America,tree,Perennial,"Grafting Propagation, Cutting, Layering Propagation, Air Layering Propagation, Tissue Culture, Seed Propagation",Average,"""7-10""",days,full sun,"March, April, May",Moderate,Medium,False,"Leprechaun Green Ash (Fraxinus pennsylvanica 'Leprechaun') is a unique and hit hard-to-find deciduous tree. It grows dense, fern-like foliage of bright emerald-green that looks amazing year-round. During the fall, its foliage turns to shades of yellow and brown, adding warmth and interest. It's also very resistant to both heat and cold. It can tolerate temperatures up to -30°F, making it ideal for an outdoor garden or landscaping project. Its strong branches and deep roots give it a reliable structure, while its pyramidal shape provides a unique aesthetic value. With its versatile design, Leprechaun Green Ash is perfect for adding a touch of charm and color to any outdoor space.",https://perenual.com/storage/species_image/294_fraxinus_pennsylvanica_leprechaun/og/5107486573_c4161ac946_b.jpg,4,4,https://perenual.com/api/hardiness-map?species_id=294&size=og&key=sk-kMpx68b02586bb61112084
295,295,295,Patmore Green Ash,Fraxinus pennsylvanica 'Patmore',Red Ash,pennsylvanica,Fraxinus,North America,tree,Perennial,"Grafting Propagation, Cutting, Layering Propagation, Air Layering Propagation, Root Suckering, Seed Propagation",Average,"""10-14""",days,full sun,"February, March, April, December, January, February",Moderate,Medium,False,"The Patmore Green Ash (Fraxinus pennsylvanica 'Patmore') is an amazing plant species. Grown for its beauty and utility, this tree is by far one of the most sought-after ornamental shade trees around. Not only is it fast-growing and adaptable to most climates, but its rich, incredibly dark green foliage makes it stand out. Plus, its gorgeous dark bark makes it a great addition to any landscape. With its resistance to the common pests and diseases, the Patmore Green Ash is an excellent choice for any garden or yard.",https://perenual.com/storage/species_image/295_fraxinus_pennsylvanica_patmore/og/Fraxinus_pennsylvanica_28510748614729.jpg,4,4,https://perenual.com/api/hardiness-map?species_id=295&size=og&key=sk-kMpx68b02586bb61112084
296,296,296,Ginkgo,Ginkgo biloba,"Maidenhair Tree, ginkgo",biloba,Ginkgo,Southern China,tree,Perennial,"Seed Propagation, Greenwood Cuttings, Grafting Propagation",Average,"""7-10""",days,Full sun,"February, March, April",Moderate,Medium,True,"Ginkgo is an amazing plant species with countless benefits. This deciduous tree can reach up to 35 meters tall and live for over 1,000 years. It has fan-shaped leaves that turn a brilliant yellow in the autumn. Because of this, it is often referred to as a living fossil. There are many health benefits associated with its leaves, including improved cognitive function and reduced risk of dementia. Ginkgo is also a source of antioxidants, which can help to reduce the effects of free radicals and protect against diseases. This unique species can even improve blood circulation and provide relief from symptoms of asthma and allergies. Ginkgo is truly an amazing plant!",https://perenual.com/storage/species_image/296_ginkgo_biloba/og/45919245951_080f8dcbb6_b.jpg,4,4,https://perenual.com/api/hardiness-map?species_id=296&size=og&key=sk-kMpx68b02586bb61112084
297,297,297,Autumn Gold Ginkgo,Ginkgo biloba 'Autumn Gold',"Maidenhair Tree, ginkgo",biloba,Ginkgo,Southern China,tree,Perennial,"Seed Propagation, Greenwood Cuttings, Grafting Propagation",Average,"""7-10""",days,full sun,"September, October, November, February, March, April, June, July, August",Moderate,Medium,True,"The Autumn Gold Ginkgo is an amazing plant species. It features a unique yellow-gold foliage throughout the summer that turns to a yellowish-orange in the fall. It also produces edible nuts. This species is not frost-hardy and requires a well drained soil and a sheltered position. It’s drought-tolerant, making it ideal for low maintenance gardens. Its two-lobed leaves are ornate and fan-shaped, giving it a unique texture and appeal that adds to any garden. Its low growing habit makes it a great choice for small gardens and grows best in full sun or partial shade. The Autumn Gold Ginkgo is an eye-catching beauty that will bring a delightful accent to your garden.",https://perenual.com/storage/species_image/297_ginkgo_biloba_autumn_gold/og/2560px-Ginkgo_biloba_27Autumn_Gold27_habitus_in_herfst.jpg,4,4,https://perenual.com/api/hardiness-map?species_id=297&size=og&key=sk-kMpx68b02586bb61112084
298,298,298,Magyar Ginkgo,Ginkgo biloba 'Magyar',"Maidenhair Tree, ginkgo",biloba,Ginkgo,Southern China,tree,Perennial,"Seed Propagation, Greenwood Cuttings, Grafting Propagation",Average,"""7-10""",days,Full sun,"March, April, March, April",Moderate,Medium,True,"Magyar Ginkgo (Ginkgo biloba 'Magyar') is an amazing specimen. This species is a rapid-growing, vase-shaped, pyramidal-shaped tree with a distinct weeping form. It offers a showy, fan-like display of golden, honey-scented fan-shaped leaves in fall, which transforms to a dazzling yellow. It produces fruit for wildlife, but not for human consumption, with its small, yellow, tough-shelled fruits, which contain a gooey substance similar to peanut butter. Magyar Ginkgo is also fairly fast growing and can reach up to 40 feet in height with a spread of 16 feet. Furthermore, this species is quite resistant to pests and diseases, making it an excellent choice for a variety of situations. All in all, Magyar Ginkgo is an incredible species that's sure to bring joy and amazement to any landscape.",https://perenual.com/storage/species_image/298_ginkgo_biloba_magyar/og/Feuilles_de_Ginkgo_biloba_en_automne.jpg,4,4,https://perenual.com/api/hardiness-map?species_id=298&size=og&key=sk-kMpx68b02586bb61112084
299,299,299,Princeton Sentry Ginkgo,Ginkgo biloba 'Princeton Sentry',"Maidenhair Tree, ginkgo",biloba,Ginkgo,Southern China,tree,Perennial,"Seed Propagation, Greenwood Cuttings, Grafting Propagation",Average,"""7-10""",days,full sun,"March, April, May",Moderate,Medium,True,"The Princeton Sentry Ginkgo (Ginkgo biloba 'Princeton Sentry') is an amazing and attractive species of tree suitable for a variety of uses. Its attractive, fan-shaped foliage is medium green in color, turning a brilliant yellow in the fall. Its oval-shaped crown offers filtered shade and makes it a great choice for street-side planting where its lush foliage can be appreciated. It has a very strong and durable trunk and is highly resistant to storm damage, while its roots remain strong and wide, making it ideal for tight spaces like small yards. Its strong resilience to air pollution and ability to thrive in a variety of soil types is unmatched, making it a great low maintenance choice.",https://perenual.com/storage/species_image/299_ginkgo_biloba_princeton_sentry/og/10447348824_071fbea762_b.jpg,4,4,https://perenual.com/api/hardiness-map?species_id=299&size=og&key=sk-kMpx68b02586bb61112084
300,300,300,Saratoga Ginkgo,Ginkgo biloba 'Saratoga',"Maidenhair Tree, ginkgo",biloba,Ginkgo,Southern China,tree,Perennial,"Seed Propagation, Greenwood Cuttings, Grafting Propagation",Frequent,"""7-10""",days,full sun,"February, March, April, May, May",Moderate,Medium,True,"Saratoga Ginkgo (Ginkgo biloba 'Saratoga') is a truly remarkable plant. It is known for its bright yellow fall foliage, adding an eye-catching pop of color when other plants are fading. Its fan-shaped leaves are distinct and make it stand out from other trees. Plus, it is known to be resistant to almost all pests and diseases, making it an ideal specimen for any garden. Its wide fan shape provides good shade, but allows light in. It's low maintenance, drought tolerant, and very easy to grow. Saratoga Ginkgo stands out among other plants and is a great addition to any landscape.",https://perenual.com/storage/species_image/300_ginkgo_biloba_saratoga/og/28520280130_eefbda4bfb_b.jpg,4,4,https://perenual.com/api/hardiness-map?species_id=300&size=og&key=sk-kMpx68b02586bb61112084
301,301,301,Sunburst Honeylocust,Gleditsia triacanthos 'Suncole',,triacanthos,Gleditsia,Central and eastern North America,tree,Perennial,"Air Layering Propagation, Grafting Propagation, Cutting, Seed Propagation",Average,"""7-10""",days,Full sun,"February, March, April",High,Moderate,False,"The Sunburst Honeylocust is an amazing tree, especially for its decorative appeal. This fast-growing tree has an oval canopy and beautiful, emerald green foliage that turns to yellow in the fall. Its small, fragrant yellow flowers burst forth in the summer, followed by the dark-colored seed pods that give it its name. It is an easy to care for tree and requires minimal pruning and fertilizing, making it a great choice for busy landscapers. Its deep, yellow-gold leaves and its readiness to thrive in many climates makes this an excellent choice for any garden.",https://perenual.com/storage/species_image/301_gleditsia_triacanthos_suncole/og/Gleditsia_triacanthos_in_Donetsk_3.jpg,4,4,https://perenual.com/api/hardiness-map?species_id=301&size=og&key=sk-kMpx68b02586bb61112084
302,302,302,Sea Buckthorn,Hippophae rhamnoides,Russian Sandthorn,rhamnoides,Hippophae,"Europe, central Asia",tree,Perennial,"Cutting, Grafting Propagation, Layering Propagation, Air Layering Propagation, Tissue Culture, Seed Propagation",Frequent,,days,full sun,"February, March, April",High,,True,"The Sea Buckthorn is an amazing shrub. It is native to the cold, coastal regions of much of Europe, Asia and North America. This hardy species can survive temperatures of -35°C and is known to thrive in difficult terrain, such as sandy beaches, sea cliffs and mountain slopes. The bushes are full of orange berries, rich in Vitamin C, flavonoids and Omega-7. As a herbal medicine they support healthy skin, nails, hair and immune system. Not only this, but Sea Buckthorn berries are a powerful antioxidant and have medicinal benefits for digestive health. Finally, the dense foliage provides shelter for animals, birds and insect species. Sea Buckthorn really is an amazing plant!",https://perenual.com/storage/species_image/302_hippophae_rhamnoides/og/52351803927_d0e7a40c57_b.jpg,3,3,https://perenual.com/api/hardiness-map?species_id=302&size=og&key=sk-kMpx68b02586bb61112084
303,303,303,Tree Form Pee Gee Hydrangea,Hydrangea paniculata 'Grandiflora (tree form)',P.G. Hydrangea,paniculata,Hydrangea,"Eastern and southern China, Japan, Sakhalin, Kuril Island",tree,Perennial,"Layering Propagation, Grafting Propagation, Cutting, Division",Average,,days,"full sun, part sun/part shade","February, January, February, August, July, August, February, August",High,Medium,False,"Tree Form Pee Gee Hydrangea is an amazing large shrub that produces hundreds of white flowers in late summer to early fall. It has strong branches that fan out into an elegant, tree like structure, making it an attractive garden feature. Its flowers start out white and turn to green and then again to purple. With its bright foliage and beautiful blooms, it brings a pleasant hint of colour to gardens throughout the season. The hedge of blooms is also attractive to pollinators like butterflies and bees. Its easy care and tidy shape make it easy to maintain and great for the home gardener. A must have for any garden!",https://perenual.com/storage/species_image/303_hydrangea_paniculata_grandiflora_tree_form/og/Hydrangea_paniculata_27Grandiflora27_kz3.jpg,4,4,https://perenual.com/api/hardiness-map?species_id=303&size=og&key=sk-kMpx68b02586bb61112084
304,304,304,Limelight Hydrangea (tree form),Hydrangea paniculata 'Limelight (tree form)',P.G. Hydrangea,paniculata,Hydrangea,"Eastern and southern China, Japan, Sakhalin, Kuril Island",tree,Perennial,"Grafting Propagation, Layering Propagation, Cutting, Division",Frequent,"""7-10""",days,"filtered shade, full sun","December, January, February, March, April, June, July, August",High,Medium,False,"The Limelight Hydrangea tree form is a stunning sight to behold each year. As an ornamental tree, it has stunning heart-shaped foliage and miniature pinecone-style flowers, which bloom in July. Its blossoms change from lime green to a deep pink, creating an eye-catching display of color. This sturdy tree can reach heights of up to 15 feet, and its branches can reach out 35 feet wide when mature. The Limelight Hydrangea tree form can be planted in a variety of soils, providing versatility for any landscape design. As an added bonus, it requires little maintenance and is highly resistant to disease, making it a reliable and sustainable choice for any home garden.",https://perenual.com/storage/species_image/304_hydrangea_paniculata_limelight_tree_form/og/Hydrangea_paniculata_03_ies.jpg,4,4,https://perenual.com/api/hardiness-map?species_id=304&size=og&key=sk-kMpx68b02586bb61112084
305,305,305,Pink Diamond Hydrangea (tree form),Hydrangea paniculata 'Pink Diamond (tree form)',P.G. Hydrangea,paniculata,Hydrangea,"Eastern and southern China, Japan, Sakhalin, Kuril Island",tree,Perennial,"Grafting Propagation, Layering Propagation, Cutting, Division",Average,"""7-10""",days,"full sun, part sun/part shade","August, February, August, February",High,,False,"The Pink Diamond Hydrangea tree is one of the most majestic and stunning flowering trees. Its long-lasting, bright pink blooms adorn the tree from early summer through to autumn, providing a memorable and eye-catching display. Its showy clusters of flowers give the tree a wonderfully full and lush appearance, and its stunning hue is a sight to behold. Growing in a rounded and compact form, the Pink Diamond Hydrangea tree is a low maintenance, easy-care choice that will remain relatively compact if pruned regularly, making it perfect for smaller garden spaces.",,4,4,https://perenual.com/api/hardiness-map?species_id=305&size=og&key=sk-kMpx68b02586bb61112084
306,306,306,Tardiva Hydrangea (tree form),Hydrangea paniculata 'Tardiva (tree form)',P.G. Hydrangea,paniculata,Hydrangea,"Eastern and southern China, Japan, Sakhalin, Kuril Island",tree,Perennial,"Layering Propagation, Cutting, Grafting Propagation, Division, Air Layering Propagation",Average,,days,"Filtered shade,  Full sun","February, March, April",High,,False,"The Tardiva Hydrangea tree form is an amazing sight in summer gardens. Popular for its full size and majestic silhouette, the Tardiva Hydrangea is an eye-catching plant with large conical clusters of silvery white buds, followed by airy white flowers in late summer. Its shrub-like form makes it an excellent option for garden borders and privacy screens. Plus, the blooms are stunning when backed by a summer sky surrounded by lush green foliage. The flowers are also attractive to pollinators, making it a lovely addition to any garden.",https://perenual.com/storage/species_image/306_hydrangea_paniculata_tardiva_tree_form/og/2560px-Hydrangea_paniculata_IMG_6629.jpg,4,4,https://perenual.com/api/hardiness-map?species_id=306&size=og&key=sk-kMpx68b02586bb61112084
307,307,307,Carpathian English Walnut,Juglans regia 'Carpathian',"Common Walnut, Persian Walnut",regia,Juglans,"Europe, central Asia",tree,Perennial,"Grafting Propagation, Layering Propagation, Cutting, Air Layering Propagation, Tissue Culture",Frequent,"""7-10""",days,full sun,"March, April, August, May, August",Moderate,Medium,True,"The Carpathian English Walnut is an amazing plant species because of its unique characteristics and unusual hardiness. This majestic tree can grow up to 35 feet tall and has a vibrant green foliage with glossy leaves that turn yellow in the fall. Its fragrant flowers give way to large round nuts, which are very popular in the culinary world. Its bark is a beautiful deep chocolate color and is often used for furniture and interior design. What makes this species of walnut truly special is its great resistance to disease and pests and its ability to thrive even in cold climates. The Carpathian English Walnut is definitely a stunning addition to any garden!",https://perenual.com/storage/species_image/307_juglans_regia_carpathian/og/nut-walnut-walnut-tree-tree.jpg,6,6,https://perenual.com/api/hardiness-map?species_id=307&size=og&key=sk-kMpx68b02586bb61112084
308,308,308,Blue Chip Juniper (tree form),Juniperus horizontalis 'Blue Chip (tree form)',,horizontalis,Juniperus,North America,tree,Perennial,"Layering Propagation, Cutting, Grafting Propagation, Division",Minimum,"""7-10""",days,"full sun, part sun/part shade","February, March, April, May",Low,Moderate,False,"The Blue Chip Juniper (tree form) is an incredible specimen of nature with an eye-catching appearance. With its bright blue-green foliage and tightly curving, horizontal branches, this gorgeous tree can provide beautiful ground cover for gardens and landscapes. It is highly durable and can tolerate a variety of soil and climate conditions, from dry rocky areas to wet clay soils. The slow, spreading growth of this juniper makes it possible for it to form a dense, sculptural hedge over time. For an added dash of extra color, the 'Blue Chip' specimen may produce pale purple or bluish-purple fruits in the fall. It is an ideal specimen for small to medium-sized yards and will instantly add beauty and grace to any outdoor space.",https://perenual.com/storage/species_image/308_juniperus_horizontalis_blue_chip_tree_form/og/Dwarf_juniper_tree_in_Yenicekale_01.jpg,2,2,https://perenual.com/api/hardiness-map?species_id=308&size=og&key=sk-kMpx68b02586bb61112084
309,309,309,Dwarf Japanese garden Juniper (tree form),Juniperus procumbens 'Nana (tree form)',Japgarden Juniper,procumbens,Juniperus,Southern Japan,tree,Perennial,"Layering Propagation, Cutting, Grafting Propagation, Division, Seed Propagation",Average,"""7-10""",days,"full sun, part sun/part shade","May, June, July, May",Low,Low,False,"The Dwarf Japanese Garden Juniper is an amazing tree for anyone looking for a low-maintenance addition to their garden. This evergreen tree is ideal for rock gardens, small spaces, and low-water gardens. It has green to blue-green foliage that turns purple in the winter, making it an attractive addition to any landscape. It has a slow growth rate and will stay small, usually reaching a maximum height of about 4 feet. Its evergreen needles won't drop and will provide year-round color and texture. Its great for maintenance free lawns, low water usage and salt resistent characteristics make it the perfect choice for a garden that requires minimal maintenance.",https://perenual.com/storage/species_image/309_juniperus_procumbens_nana_tree_form/og/46569652812_99306626ca_b.jpg,4,4,https://perenual.com/api/hardiness-map?species_id=309&size=og&key=sk-kMpx68b02586bb61112084
310,310,310,Rocky Mountain Juniper,Juniperus scopulorum,Colorado Redcedar,scopulorum,Juniperus,"United States, Canada",tree,Perennial,"Seed Propagation, Cutting, Layering Propagation, Grafting Propagation, Air Layering Propagation",Average,"""7-10""",days,Full sun,"February, March, April",Low,Medium,True,"Rocky Mountain Juniper (Juniperus scopulorum) is an amazing evergreen coniferous shrub. Native to rocky, mountainous regions of western North America, it is an extremely hardy, low- maintenance plant. Its branches form a dense canopy of slender, steel-blue-green needle-like leaves and small, berry-like cones. Rocky Mountain Juniper can easily survive in windswept areas and tolerate drought, requiring little care once established. Its unique, attractive blue foliage is an eye-catching feature for any garden and this juniper's slow growth rate means it can be kept very small in containers, allowing for flexible placement. Whether you prefer it for its ornamental beauty or its low maintenance, Rocky Mountain Juniper is a great choice for any outdoor space.",https://perenual.com/storage/species_image/310_juniperus_scopulorum/og/52150927411_90eb160ee5_b.jpg,3,3,https://perenual.com/api/hardiness-map?species_id=310&size=og&key=sk-kMpx68b02586bb61112084
311,311,311,Blue Star Juniper,Juniperus squamata 'Blue Star (tree form)',"Singleseed Juniper, Blue Star juniper",squamata,Juniperus,"Central, west Asia",tree,Perennial,"Cutting, Grafting Propagation, Layering Propagation, Air Layering Propagation, Seed Propagation",Average,"""7-10""",days,"full sun, part sun/part shade","May, June, July, May",Low,Moderate,False,"The Blue Star Juniper is an amazing coniferous shrub due to its elegance and impressive light bluish foliage. Growing in tree form, it has an airy and open growth habit, offering an attractive low-maintenance evergreen accent in any landscape setting. It can produce a beautiful silver-green foliage covering, feature in gardens year-round. The attractive foliage turns to a deep purple during the winter months. It loves full sun, so it flourishes in heat tolerant areas. Its scale-like foliage also make excellent wind protection for your garden. With a moderate growth rate and little care, the Blue Star Juniper is the perfect choice for gardeners who want a year-round colour pop in their outdoor space.",https://perenual.com/storage/species_image/311_juniperus_squamata_blue_star_tree_form/og/52579851871_5ee59e67dd_b.jpg,4,4,https://perenual.com/api/hardiness-map?species_id=311&size=og&key=sk-kMpx68b02586bb61112084
312,312,312,Daub's Frosted Juniper (tree form),Juniperus x media 'Daub's Frosted (tree form)',,,Juniperus,Germany,tree,Perennial,"Cutting, Grafting Propagation, Layering Propagation, Air Layering Propagation, Tissue Culture",Frequent,"""7-10""",days,"full sun, part shade","May, June, July, May",High,Medium,False,"Daub's Frosted Juniper (tree form) is a stunning choice for landscaping. This evergreen conifer has an especially attractive form, with silvery-blue foliage and a compact, cone-shaped crown. Its slow growth rate makes it perfect for smaller yards with limited space, though it can also be trimmed and maintained in a coiffed style. Its needles are also resistant to damage by wind, cold and salt, making it a perfect choice for beachfront areas. In late winter, its flowers appear as clusters of yellow-green fruits. All in all, Daub's Frosted Juniper is a beautiful and hardy choice for gardeners looking for a low-maintenance, durable tree.",https://perenual.com/storage/species_image/312_juniperus_x_media_daubs_frosted_tree_form/og/46569652812_99306626ca_b.jpg,4,4,https://perenual.com/api/hardiness-map?species_id=312&size=og&key=sk-kMpx68b02586bb61112084
