id,general_plant_id,threatened_plant_id,common_name,scientific_name,other_name,species_epithet,genus,origin,type,cycle,propagation,watering,watering_benchmark,watering_unit,sunlight,pruning_month,growth_rate,care_level,medicinal,description,image_url,hardiness_min,hardiness_max,hardiness_map_url
180,180,180,Monkey Puzzle Tree,Araucaria araucana,Chilean Pine,araucana,Araucaria,"Chile, Argentina",tree,Perennial,"Seed Propagation, Greenwood Cuttings, Greenwood Cuttings, Hardwood Cuttings",Average,"""7-10""",days,"full sun, part shade","March, April, March, April",Moderate,High,False,"The Monkey Puzzle Tree, also known as Araucaria araucana, has an impressive and unique look sure to impress. It's extraordinarily tall, cone-shaped crown, combined with its tough, spiky evergreen leaves create an austere and mysterious look. It's a symbol of ancient forests, having survived many ice ages and growing to heights of over 175 feet. This tree has one of the longest lifespans of any species, living to an impressive 2000 years. It's a hardy species, adapted to survive many climates, making it a great choice for landscaping. The Monkey Puzzle Tree is truly an amazing specimen sure to draw admiration and attention.",https://perenual.com/storage/species_image/180_araucaria_araucana/og/36535778593_bc16b86591_b.jpg,8,8,https://perenual.com/api/hardiness-map?species_id=180&size=og&key=sk-ACnv68b0630adff3b12096
181,181,181,Marina Strawberry Tree,Arbutus 'Marina',,'Marina',Arbutus,"Portugal, Spain, Morocco, Algeria, Tunisia, Libya",tree,Perennial,"Air Layering Propagation, Grafting Propagation, Cutting, Seed Propagation",Frequent,"""7-10""",days,"full sun, part shade","March, April, May, August, March, April, May, August",Low,Medium,False,"The Marina Strawberry Tree is an amazing evergreen shrub that produces beautiful white-pink flowers in spring and small apple-like fruits in summer. This small tree is an excellent addition to every garden and can even be used as a patio plant. It is a hardy tree that requires little care and maintenance and possesses a unique, compact shape. Its rich green foliage and bark with beautiful peeling texture make this shrub stand out. It is a great attraction to various birds and garden pollinators. Furthermore, it is salt tolerant, drought tolerant and cold tolerant, making it an ideal plant for most landscapes.",https://perenual.com/storage/species_image/181_arbutus_marina/og/50783640608_7dfdc41b15_b.jpg,9,9,https://perenual.com/api/hardiness-map?species_id=181&size=og&key=sk-ACnv68b0630adff3b12096
182,182,182,Pacific Madrone*,Arbutus menziesii,"Madrona; Bearberry; Strawberry Tree, madrona",menziesii,Arbutus,Western North America,tree,Perennial,"Seed Propagation, Greenwood Cuttings",Minimum,"""7-10""",days,sun,"March, April, May, June, July, August, September, February, June, December, January, February",Low,Medium,True,"Pacific Madrone (Arbutus menziesii) is an evergreen tree native to the West Coast of North America. It is an incredibly hardy and resilient species, with a brilliant natural range of color and texture that makes it stand out from other trees. The tree often has striking pale, orange-red bark that is dotted with patches of smooth, bronze-toned bark. In the summertime, its foliage is a bright green, making it a wonderfully cheerful sight. In the fall, the plant transitions to a yellow-brown color, adding to its stunning beauty. Those who grow Pacific Madrone benefit from its ability to thrive in diverse conditions and its tolerance of summer drought. Its showy and unique appearance makes it a great choice for gardens, landscaping, and other projects.",https://perenual.com/storage/species_image/182_arbutus_menziesii/og/22374647353_94489902ef_b.jpg,9,9,https://perenual.com/api/hardiness-map?species_id=182&size=og&key=sk-ACnv68b0630adff3b12096
183,183,183,Strawberry Tree,Arbutus unedo,Apple of Cain; Cane Apple,unedo,Arbutus,"Southern Europe, western Asia, northern Africa",tree,Perennial,"Greenwood Cuttings, Greenwood Cuttings, Hardwood Cuttings, Seed Propagation",Average,"""7-10""",days,"full sun, part sun/part shade, sheltered","March, April",Moderate,Medium,True,"The Strawberry Tree (Arbutus unedo) is an amazing species that offers year-round beauty. It is a fruiting evergreen with attractive foliage and delicate whitish-pink blooms that develop into bright, red-orange fruits throughout the season. In addition to its showy beauty, this plant is incredibly hardy and can survive in a wide range of soil types and light conditions. With its easy maintenance and interesting lifestyle, the Strawberry Tree is a must for any gardener looking for a low-care, eye-catching addition to their landscape.",https://perenual.com/storage/species_image/183_arbutus_unedo/og/50433219232_449b440340_b.jpg,7,7,https://perenual.com/api/hardiness-map?species_id=183&size=og&key=sk-ACnv68b0630adff3b12096
184,184,184,Common Paw Paw,Asimina triloba,"Pawpaw Apple, False-Banana, Poor Man's Banana, Pawpaw, False Banana, Pawpaw Custardapple",triloba,Asimina,Southeastern United States,tree,Perennial,Grafting Propagation,Average,"""7-10""",days,"full sun, part sun/part shade","February, March, April, May",Moderate,Medium,True,"The Common Paw Paw is an amazing, versatile species native to North America. Not only can the cooked fruit be used in desserts and other culinary dishes, but the seeds, leaves and bark can also provide medicinal benefits. The plant itself is quite drought tolerant, and can be grown in many different soils with minimal maintenance. The plant produces large, fragrant flowers and beautiful green leaves, making it a great ornamental species. A great choice for any garden, the Common Paw Paw also provides delicious fruits that can be enjoyed or stored for winter when in season.",https://perenual.com/storage/species_image/184_asimina_triloba/og/36488336082_9d0132fcd0_b.jpg,5,5,https://perenual.com/api/hardiness-map?species_id=184&size=og&key=sk-ACnv68b0630adff3b12096
185,185,185,Crimson Frost Birch,Betula 'Crimson Frost',,'Crimson,Betula,Japan,tree,Perennial,"Cutting, Grafting Propagation, Layering Propagation, Seed Propagation",Frequent,"""7-10""",days,"full sun, part shade","March, April, March, April, May",Low,Medium,False,"Crimson Frost Birch (Betula 'Crimson Frost') is an amazing ornamental tree with several features that make it stand out. Its signature trait is its striking deep pink-red leaves that look especially vibrant against the green foliage. When Fall arrives, its foliage takes on a scarlet hue, making this variety outstanding during the winter months. Crimson Frost Birch is also highly adaptable, growing in various soils and climates, including drought conditions. Its bark is an eye-catching whitish gray color and the shape is an elegant oval, making it an ideal choice for both home gardens and public parks alike.",https://perenual.com/storage/species_image/185_betula_crimson_frost/og/B._pubescens_f._rubra_2.jpg,4,4,https://perenual.com/api/hardiness-map?species_id=185&size=og&key=sk-ACnv68b0630adff3b12096
186,186,186,River Birch,Betula nigra,Red Birch,nigra,Betula,Eastern United States,tree,Perennial,"Seed Propagation, Greenwood Cuttings",Average,"""3-4""",days,"full sun, part shade","February, March, April, February, March",High,Medium,False,"River Birch (Betula nigra) is an amazing tree species and one of nature's wonders. It can endure most harsh weather conditions, surviving in temperate and subtropical areas. Not only is the River Birch a hardy species, but it is also a beautiful sight. With widespread branches of an ebony hue, it towers with elegance and grace. It produces two to three-inch catkins in the spring which bloom with tiny yellow flowers. As fall turns to winter, the leaves transform from their typical green to a brilliant bronze. River Birch is the perfect species for any garden or landscape, providing shade and long-term enjoyment.",https://perenual.com/storage/species_image/186_betula_nigra/og/38242143172_2670c4b8e2_b.jpg,3,3,https://perenual.com/api/hardiness-map?species_id=186&size=og&key=sk-ACnv68b0630adff3b12096
187,187,187,River Birch (clump),Betula nigra '(clump)',Red Birch,nigra,Betula,Eastern United States,tree,Perennial,"Seed Propagation, Greenwood Cuttings",Average,"""3-4""",days,"full sun, part shade","March, April, March, April",High,Medium,False,"The River Birch (clump) (Betula nigra '(clump)') is an amazing plant species due to its unique benefits. This striking, deciduous tree has lovely, silvery-white bark, adding a unique and attractive addition to any landscape throughout the year. Unlike single trunks, the clumped form multiplies, allowing the tree to grow a denser canopy. The River Birch prefers to live in moist and swampy areas, making it an ideal choice for drainage or wet areas. Best of all, it is among the most resistant tree species to insect infestations and diseases, which makes it a great choice for arborists and homeowners alike. Not only that, but it also shows great tolerance to urban sites.",https://perenual.com/storage/species_image/187_betula_nigra_clump/og/23420494494_ce4115fc2c_b.jpg,3,3,https://perenual.com/api/hardiness-map?species_id=187&size=og&key=sk-ACnv68b0630adff3b12096
188,188,188,Summer Cascade Weeping River Birch,Betula nigra 'Summer Cascade',Red Birch,nigra,Betula,Eastern United States,tree,Perennial,"Seed Propagation, Greenwood Cuttings",Average,,days,"Full sun, part shade","June, July, August, March, April",High,Medium,False,"Summer Cascade Weeping River Birch (Betula nigra 'Summer Cascade') is an amazing plant species. It has an eye-catching cascading form and its beauty enhances in the summer when its delicate foliage takes on a bronze hue. Its leaves also have saw-toothed edges and perform best in moist, well-draining soils in full sun to light shade. Summer Cascade is also heat and drought tolerant, making it a great choice for the garden. Its graceful form naturally creates an amazing backdrop and adds a sense of serenity to any landscape. It's an ideal choice for small spaces or containers. With its outstanding beauty, low maintenance and adaptability, the Summer Cascade is sure to be a showstopper in any landscape.",https://perenual.com/storage/species_image/188_betula_nigra_summer_cascade/og/Betula_nigra_Summer_Cascade_0zz.jpg,3,3,https://perenual.com/api/hardiness-map?species_id=188&size=og&key=sk-ACnv68b0630adff3b12096
189,189,189,Paper Birch,Betula papyrifera,"White Birch, Canoe Birch",papyrifera,Betula,North America,tree,Perennial,"Seed Propagation, Cutting",Average,"""3-4""",days,"full sun, part shade","March, April, April, May",High,Medium,True,"Paper Birch (Betula papyrifera) is an amazing species of tree due to its unique white bark and graceful shape. It grows quickly, reaching 70 feet or higher, with a densely-packed crown of drooping branches. The trunk of a paper birch is light grey, and its bark peels off in long strips that add to its beauty. It is also incredibly durable, withstanding storms and temperatures down to -60 degrees Fahrenheit. The bark is often used in art, while the twigs and leaves make excellent tinder for campfires. Its autumn colors also make it a popular choice for landscaping. It's clear why Paper Birch is an amazing species.",https://perenual.com/storage/species_image/189_betula_papyrifera/og/29933086455_99ed2521e9_b.jpg,2,2,https://perenual.com/api/hardiness-map?species_id=189&size=og&key=sk-ACnv68b0630adff3b12096
190,190,190,Clump Paper Birch,Betula papyrifera '(clump)',"White Birch, Canoe Birch",papyrifera,Betula,North America,tree,Perennial,"Seed Propagation, Cutting",Average,,days,"full sun, part shade","February, March, April",High,Medium,False,"Clump paper birch (Betula papyrifera 'clump') is an amazing tree species. It is a native tree of northern North America, and it prefers moist, acidic soil. Its beautiful, paper-like bark and bright white trunk, make it a favorite ornamental and shade tree. Clump paper birch is also a great choice for erosion control, due to its short, wide spread. Its leaves turn a vibrant, golden yellow in the fall, adding stunning autumn color to any landscape. Its easy to grow, and very tolerant of urban conditions and windy sites. Clump paper birch is an ideal tree for anyone looking for a great ornamental tree with a wonderful, elegant shape.",https://perenual.com/storage/species_image/190_betula_papyrifera_clump/og/22580953798_d6404aaf4f_b.jpg,2,2,https://perenual.com/api/hardiness-map?species_id=190&size=og&key=sk-ACnv68b0630adff3b12096
191,191,191,Whitespire Birch,Betula populifolia 'Whitespire',Betula platyphylla,populifolia,Betula,Eastern North America,tree,Perennial,"Cutting, Grafting Propagation, Layering Propagation, Air Layering Propagation, Seed Propagation",Average,"""7-10""",days,"part sun/part shade, full sun","February, March, April",Low,Moderate,False,"Whitespire Birch (Betula populifolia 'Whitespire') is a stunning deciduous tree with a truly stunning white bark. It is native to eastern North America and is a great choice for landscaping due to its size and graceful structure. In addition to its attractive exterior, Whitespire Birch is also known for its tolerance to drought and it is relatively pest and disease-resistant. The leaves of this tree are also admired for its blue-green color and its serrated shape that becomes yellow in the fall. For those looking to liven up a space, Whitespire Birch is a great option that offers both ecological benefits and beauty.",https://perenual.com/storage/species_image/191_betula_populifolia_whitespire/og/Betula_populifolia_leaves.jpg,4,4,https://perenual.com/api/hardiness-map?species_id=191&size=og&key=sk-ACnv68b0630adff3b12096
192,192,192,Whitebark Himalayan Birch,Betula utilis 'var. jacquemontii',White Bark Birch,utilis,Betula,Himalayas,tree,Perennial,"Cutting, Grafting Propagation, Layering Propagation, Air Layering Propagation, Stem Propagation, Root Cutting, Division, Seed Propagation",Average,"""7-10""",days,full sun,"May, June, July",Low,Medium,False,"The Whitebark Himalayan Birch (Betula utilis 'var. jacquemontii') is an amazing species due to its tough constitution and beautiful foliage. This species grows into a large tree with a thick trunk and up-to-30 meter-long branches, making it an ultimate addition to any landscape. It displays a stunning white bark that provides a great contrast with its green leaves and its ability to withstand high altitudes and cold climate allows it to thrive in mountains- its native habitat. Not only is this species beautiful, it is also highly beneficial as it provides excellent pollinator and wildlife habitat as well as erosion-protection.",https://perenual.com/storage/species_image/192_betula_utilis_var_jacquemontii/og/9020914937_f8664866cf_b.jpg,6,6,https://perenual.com/api/hardiness-map?species_id=192&size=og&key=sk-ACnv68b0630adff3b12096
193,193,193,California Incense Cedar,Calocedrus decurrens,Incensecedar,decurrens,Calocedrus,"Western United States, Mexico",tree,Perennial,Seed Propagation,Minimum,"""7-10""",days,"full sun, part shade","March, April",High,Medium,False,"California Incense Cedar (Calocedrus decurrens) is an amazing tree species that is native to western North America. It has an attractive ""flare-shaped"" silhouette with enticing orange-brown bark, and its cascades of feathery branches are dotted with vivid green needles that give off a sweet cedar scent. Its moderate growth rate and close-knit branches make it an excellent privacy screen or windbreak, while its longevity and resistance to disturbance make it an excellent choice for many landscapes. Wildlife benefit from its dense foliage, as it provides excellent habitat for birds and other animals. Furthermore, it is very fire-resistant and can tolerate drought, making it a great choice for areas susceptible to wildfires. California Incense Cedar is an amazing species for any landscape.",https://perenual.com/storage/species_image/193_calocedrus_decurrens/og/49153226872_1bf8feac75_b.jpg,5,5,https://perenual.com/api/hardiness-map?species_id=193&size=og&key=sk-ACnv68b0630adff3b12096
194,194,194,European Hornbeam,Carpinus betulus,Common Hornbeam,betulus,Carpinus,"Europe, Asia",tree,Perennial,Cutting,Average,"""7-10""",days,"full sun, part shade","February, March, April, March, April, May, March, April, May, June, July, August",Low,,False,"The European Hornbeam (Carpinus betulus), often known as the Ironwood, is an amazing tree for many reasons. It is noted for its striking yellow-green foliage, often going through a range of shades from late summer through to autumn. It is hardy, drought tolerant and slow growing, making it ideal for smaller gardens. The wood of the Hornbeam is very hard and durable, and it has even been used for making furniture. Its spreading canopy creates a great amount of shade and provides habitats for wildlife. In short, the European Hornbeam is an ideal choice for adding both beauty and practicality to the garden.",https://perenual.com/storage/species_image/194_carpinus_betulus/og/52308565694_a3de5a41fc_b.jpg,5,5,https://perenual.com/api/hardiness-map?species_id=194&size=og&key=sk-ACnv68b0630adff3b12096
195,195,195,Pyramidal European Hornbeam,Carpinus betulus 'Fastigiata',Common Hornbeam,betulus,Carpinus,"Europe, Asia",tree,Perennial,Cutting,Average,"""7-10""",days,"full sun, part shade",February,Low,Moderate,False,"Pyramidal European Hornbeam (Carpinus betulus 'Fastigiata') is an amazing tree that is perfect for landscaping. This tree will add extra depth and definition to any outdoor area, as it forms a tall, conical shape that is both eye catching and aesthetically pleasing. It's a relatively low maintenance tree, only requiring occasional trimming and occasional fertilization. In addition to its beauty, this species has a durable, steadfast quality and can withstand tough weather conditions, such as wind, snow and ice. It is also very resilient and low allergy, making it a safe choice of tree for anyone with allergies.",https://perenual.com/storage/species_image/195_carpinus_betulus_fastigiata/og/49080668718_25410417d6_b.jpg,5,5,https://perenual.com/api/hardiness-map?species_id=195&size=og&key=sk-ACnv68b0630adff3b12096
196,196,196,Frans Fontaine Hornbeam,Carpinus betulus 'Frans Fontaine',Common Hornbeam,betulus,Carpinus,"Europe, Asia",tree,Perennial,Cutting,Average,"""7-10""",days,full sun,"April, May",Low,Medium,False,"The Frans Fontaine Hornbeam is an amazing small tree, with beautiful foliage that adds elegance to any landscape. Its dark green foliage turns golden-yellow in the fall and winter, providing year-round visual interest. In spring and summer, it produces lovely white flowers that will attract butterflies and other pollinators. Its distinctive columnar shape makes it perfect for narrow gardens, as it doesn't take up too much space. Due to its strong and durable wood, the Frans Fontaine Hornbeam is long-lasting, making it an excellent choice for tree-lined streets and commercial landscapes. Its relatively low maintenance makes it suitable for beginner gardeners, too. If you're looking for a beautiful and practical tree, look no further than Frans Fontaine Hornbeam!",https://perenual.com/storage/species_image/196_carpinus_betulus_frans_fontaine/og/49080668718_25410417d6_b.jpg,5,5,https://perenual.com/api/hardiness-map?species_id=196&size=og&key=sk-ACnv68b0630adff3b12096
197,197,197,Weeping European Hornbeam,Carpinus betulus 'Pendula',Common Hornbeam,betulus,Carpinus,"Europe, Asia",tree,Perennial,Cutting,Average,"""7-10""",days,"full sun, part sun/part shade","February, March, April, May",Low,Medium,False,"Weeping European Hornbeam (Carpinus betulus 'Pendula') is an amazing plant species and an excellent choice for a specimen tree in any garden. It boasts an open, spreading canopy of glossy green foliage that provide shade and lushness to any space. This ornamental tree thrives in full sun, displaying cascading branches that sweep gracefully down to ground level and hover above the landscape. Its unique form, hardiness and long-lasting yellowish catkins make weeping European hornbeam an excellent choice for winter interest. It is fast-growing and low-maintenance, making it an ideal choice for any landscape design.",https://perenual.com/storage/species_image/197_carpinus_betulus_pendula/og/Carpinus_betulus_Pendula_1zz.jpg,5,5,https://perenual.com/api/hardiness-map?species_id=197&size=og&key=sk-ACnv68b0630adff3b12096
198,198,198,Japanese Hornbeam,Carpinus japonica,,japonica,Carpinus,Japan,tree,Perennial,"Air Layering Propagation, Grafting Propagation, Cutting, Seed Propagation",Average,"""7-10""",days,"part shade, full shade","March, April, May, December, January, February",Low,Medium,False,"The Japanese Hornbeam (Carpinus japonica) is truly a magnificent and unique tree species! Native to Japan, this evergreen tree has a distinctive, multi-faceted trunk leading to a wonderfully bushy, dense canopy. Its simple, glossy green leaves will turn a beautiful golden-yellow in autumn and winter. The Japanese Hornbeam can live for more than 200 years, making it an incredibly rugged and reliable species. It is also relatively drought-tolerant and can thrive in both shade and full sun. It's perfect for urban settings, as it is highly resistant to air pollution and requires little maintenance. The Japanese Hornbeam is truly an amazing tree species!",https://perenual.com/storage/species_image/198_carpinus_japonica/og/21398773531_f81737abbd_b.jpg,5,5,https://perenual.com/api/hardiness-map?species_id=198&size=og&key=sk-ACnv68b0630adff3b12096
199,199,199,Golden Catalpa,Catalpa bignonioides 'Aurea',Southern Catalpa,bignonioides,Catalpa,Southeastern United States,tree,Perennial,"Air Layering Propagation, Grafting Propagation, Cutting, Seed Propagation",Average,"""7-10""",days,"full sun, part shade","February, March, April, May",Low,Medium,False,"Golden Catalpa (Catalpa bignonioides 'Aurea') is a great plant species for those who want an eye-catching addition to their garden. Famous for its vibrant yellow foliage, this tree is sure to make a statement. In addition to its striking foliage, the Golden Catalpa produces white blooms which turn into Seedpods that gradually turn from green to brown and can be used to decorate outdoor spaces. Its low-maintenance nature and drought tolerance make it an ideal choice for many landscapes. The Golden Catalpa's incredible appearance and easy-care make it an amazing choice for gardeners looking for a stunningly beautiful and hardy plant.",https://perenual.com/storage/species_image/199_catalpa_bignonioides_aurea/og/9207605354_43a5ee5982_b.jpg,6,6,https://perenual.com/api/hardiness-map?species_id=199&size=og&key=sk-ACnv68b0630adff3b12096
200,200,200,Blue Atlas Cedar,Cedrus atlantica 'Glauca',,atlantica,Cedrus,Northern Africa,tree,Perennial,"Cutting, Grafting Propagation, Layering Propagation, Air Layering Propagation, Seed Propagation",Average,"""7-10""",days,"full sun, part shade","March, April",Low,Moderate,True,"The Blue Atlas Cedar (Cedrus atlantica 'Glauca') is a stunning conifer that is hardy and easy to grow. It is native to the Atlas Mountains of Algeria and Morocco and is known for its eye catching powder blue foliage. It is both drought and cold tolerant, growing to heights of up to 80 feet tall, with a pyramidal shape. Its foliage is evergreen so it brings color to the garden all year round. It is widely used as an ornamental tree, as it is strikingly beautiful and needs very low maintenance. A perfect addition to anyone’s garden.",https://perenual.com/storage/species_image/200_cedrus_atlantica_glauca/og/33077930105_cc2b0dac42_b.jpg,7,7,https://perenual.com/api/hardiness-map?species_id=200&size=og&key=sk-ACnv68b0630adff3b12096
201,201,201,Deodar Cedar,Cedrus deodara,Himalayan Cedar,deodara,Cedrus,Himalayas,tree,Perennial,Seed Propagation,Average,"""7-10""",days,full sun,"February, March, April",High,Medium,True,"Deodar Cedar, or Cedrus deodara, is an amazing species of evergreen tree. Unlike most coniferous trees, Deodar Cedar takes on an airy, open branching structure, creating a unique and majestic shape. The soft, blue-green needles create an enchanting backdrop to its deep rusty-brown bark. Deodar Cedar is adaptable to diverse environments and can even thrive in areas with acidic soil. This species is also extremely tolerant to extreme temperatures, making it a great choice for temperatures ranging from hot to cold. Deodar Cedar is an impressive and eye-catching tree species that is sure to make any landscape look stunning.",https://perenual.com/storage/species_image/201_cedrus_deodara/og/48834607038_84597f56f4_b.jpg,7,7,https://perenual.com/api/hardiness-map?species_id=201&size=og&key=sk-ACnv68b0630adff3b12096
202,202,202,Golden Deodar Cedar,Cedrus deodara 'Aurea',Himalayan Cedar,deodara,Cedrus,Himalayas,tree,Perennial,Seed Propagation,Average,"""7-10""",days,full sun,"February, March, April",High,Moderate,False,"Golden Deodar Cedar (Cedrus deodara 'Aurea') is an amazing plant species that adds unique beauty and character to any garden. Its bright golden needles and red-orange bark provide a stunning contrast to any landscape design. It grows quickly with a pyramidal shape, making it a great fit for any size garden or yard. Furthermore, its foliage responds well to shearing, so it can be pruned and shaped to fit any desired style. It is an especially hardy species and well suited for areas of low precipitation and cold temperatures. The Golden Deodar Cedar offers a regal elegance to any garden that makes it truly special.",https://perenual.com/storage/species_image/202_cedrus_deodara_aurea/og/Cedrus_deodara_Aurea_1zz.jpg,7,7,https://perenual.com/api/hardiness-map?species_id=202&size=og&key=sk-ACnv68b0630adff3b12096
